"title","views","likes","dislikes","comments","favorites","url","publishedAt","description","tags","embeddable","duration","thumbnail","related_to_video","video_category"
"Carlos Minc - Mais um absurdo da bancada ruralista","1766","279","20","6","0","https://www.youtube.com/watch?v=IggYzwLQ4Ic","2018-05-14T01:56:09.000Z","Carlos Minc fala em sua coluna sobre o projeto de lei do Blairo Maggi, que libera o registro de agrotóxicos no Brasil, aumentando o veneno no nosso alimento do dia-a-dia. 

Pela nova proposta, a liberação de agrotóxicos ficaria centralizada no Ministério da Agricultura, apenas com pareceres da Anvisa e do Ibama. Hoje, a análise é feita em cada um desses órgãos.","['mídia NINJA', 'NINJA', 'midia livre', 'agrotóxicos', 'anvisa', 'veneno', 'carlos', 'carlos minc']",True,"PT2M8S","https://i.ytimg.com/vi/IggYzwLQ4Ic/hqdefault.jpg","https://www.youtube.com/watch?v=u24T591O85w,https://www.youtube.com/watch?v=7gfK6bssjHE,https://www.youtube.com/watch?v=Mfv-4zQ9_Q0,https://www.youtube.com/watch?v=1MQywFa1zNQ,https://www.youtube.com/watch?v=E7nMwTqFX4k,","Sem fins lucrativos/ativismo"
"Pastor Ariovaldo:  'Exijo que parem de apontar suas armas para a cor da minha pele'  #FalsaAbolição","1554","256","16","27","0","https://www.youtube.com/watch?v=xbxpypD9NFc","2018-05-13T23:40:34.000Z","No mês de maio, o Brasil completa 130 anos de falsa abolição da escravatura. Isso porque a lei que libertou os escravos não garantiu direitos e oportunidades para os negros e as negras. Assista o colunista e pastor Ariovaldo falando sobre negritude, as injustiças as quais os negros libertos foram submetidos, e como até hoje, resistem.","['mídia NINJA', 'NINJA', 'midia livre', 'Falsa Abolição', '13 de maio', 'Escravatura', 'Lei Aurea', 'Pastor Ariovaldo']",True,"PT5M23S","https://i.ytimg.com/vi/xbxpypD9NFc/hqdefault.jpg","https://www.youtube.com/watch?v=7gfK6bssjHE,https://www.youtube.com/watch?v=afb-jTagiaA,https://www.youtube.com/watch?v=5nWCSVSgjqU,https://www.youtube.com/watch?v=kmvgDn-lpNQ,https://www.youtube.com/watch?v=Ge7OiUqFB0I,","Sem fins lucrativos/ativismo"
"Henrique Vieira - O Discursos de Bolsonaro Versus o Evangelho de Jesus","7765","851","140","155","0","https://www.youtube.com/watch?v=7gfK6bssjHE","2018-05-11T20:08:09.000Z","Os discursos e as posições de Bolsonaro são incompatíveis com os ensinamentos de Jesus. Com integridade e coragem, é preciso ter posição. Falas que estimulam o ódio não tem base no Evangelho. Vamos refletir!

Finâncie a Mídia NINJA http://catarse.me/midianinja","['mídia NINJA', 'NINJA', 'midia livre', 'henrique vieira', 'bolsonaro', 'bolsonaro ódio', 'intolerância', 'evangelho de jesus', 'jesus cristo', 'pastor', 'pastor henrique', 'pastor vieira']",True,"PT4M52S","https://i.ytimg.com/vi/7gfK6bssjHE/hqdefault.jpg","https://www.youtube.com/watch?v=e1gSZl7LJ-k,https://www.youtube.com/watch?v=ZdWQjQMwzck,https://www.youtube.com/watch?v=bf2EYulUOQE,https://www.youtube.com/watch?v=9Qp8yg848bk,https://www.youtube.com/watch?v=hQSWrblm3K0,","Sem fins lucrativos/ativismo"
"Por Trás da Lona - A vida na ocupação Povo Sem Medo do Capão","1893","247","16","29","0","https://www.youtube.com/watch?v=h9sNHRzqAhI","2018-05-06T22:14:32.000Z","O surgimento e o dia a dia de uma ocupação do MTST visto de dentro. Em 2016 a Mídia NINJA documentou os desafios e dramas da então recém criada Povo Sem Medo do  Capão Redondo, na Zona Sul de São Paulo. Um filme experimental e imersivo sobre a realidade de milhões de brasileiras e brasileiros na busca pelo direito à moradia.

Financie a Mídia NINJA: Http://catarse.me/midianinja","['Mtst', 'movimento dos trabalhadores sem teto', 'movimento moradia', 'moradia', 'especulação imobiliária', 'guilherme Boulos', 'capão redondo', 'Mídia NINJA', 'NINJA']",True,"PT18M6S","https://i.ytimg.com/vi/h9sNHRzqAhI/hqdefault.jpg","https://www.youtube.com/watch?v=kmvgDn-lpNQ,https://www.youtube.com/watch?v=_FpOVyJKPEs,https://www.youtube.com/watch?v=1_LGznJiGQc,https://www.youtube.com/watch?v=60Tq68H3SqY,https://www.youtube.com/watch?v=KE41Hiw285A,","Sem fins lucrativos/ativismo"
"Rachel Rolnik: A tragédia do Paissandu e as políticas habitacionais","1559","243","11","13","0","https://www.youtube.com/watch?v=JCpmChuNN6k","2018-05-06T20:33:56.000Z","O direito à moradia tem que ser absolutamente separado da ideia de que a moradia é uma mercadoria e mais separado ainda da ideia de que a moradia é um ativo financeiro, ou que o espaço construído é um ativo financeiro. 
Confira a entrevista de Raquel Rolnik para a Mídia NINJA!","['mídia NINJA', 'NINJA', 'midia livre', 'Rachel Rolnik', 'Paissandu', 'Largo do Paissandu', 'Ocupação', 'Políticas habitacionais', 'moradia', 'São Paulo', 'QuemOcupaNãoTemCulpa']",True,"PT3M10S","https://i.ytimg.com/vi/JCpmChuNN6k/hqdefault.jpg","https://www.youtube.com/watch?v=kmvgDn-lpNQ,https://www.youtube.com/watch?v=wyjm4k0iqOE,https://www.youtube.com/watch?v=sxwBbZcEVRc,https://www.youtube.com/watch?v=CbZ6IllCcts,https://www.youtube.com/watch?v=TPXTiQPGZoo,","Sem fins lucrativos/ativismo"
